{
  "$schema": "https://json-schema.org/draft/2020-12/schema",
  "$id": "https://github.com/camunda/skills/compatibility/portability.schema.json",
  "title": "Camunda skill portability declaration",
  "type": "object",
  "additionalProperties": false,
  "required": [
    "$schema",
    "skillDirectory",
    "skillName",
    "status",
    "agentSkillsSpec",
    "harnesses",
    "requires",
    "limitations",
    "differences"
  ],
  "properties": {
    "$schema": {
      "type": "string",
      "const": "https://raw.githubusercontent.com/camunda/skills/main/compatibility/portability.schema.json"
    },
    "skillDirectory": {
      "type": "string",
      "not": {
        "enum": ["skills/anthropic", "skills/claude"]
      },
      "pattern": "^skills/[a-z0-9]+(?:-[a-z0-9]+)*$"
    },
    "skillName": {
      "type": "string",
      "maxLength": 64,
      "not": {
        "enum": ["anthropic", "claude"]
      },
      "pattern": "^[a-z0-9]+(?:-[a-z0-9]+)*$"
    },
    "status": {
      "type": "string",
      "enum": ["portable", "portable-with-adapter", "harness-specific"]
    },
    "agentSkillsSpec": {
      "type": "object",
      "additionalProperties": false,
      "required": ["specUrl", "specRevisionOrAuditDate"],
      "properties": {
        "specUrl": {
          "type": "string",
          "format": "uri",
          "const": "https://agentskills.io/specification"
        },
        "specRevisionOrAuditDate": {
          "type": "string",
          "minLength": 1
        }
      }
    },
    "harnesses": {
      "type": "object",
      "additionalProperties": false,
      "required": ["claude", "copilot", "generic"],
      "properties": {
        "claude": {
          "$ref": "#/$defs/harnessDeclaration"
        },
        "copilot": {
          "$ref": "#/$defs/harnessDeclaration"
        },
        "generic": {
          "$ref": "#/$defs/harnessDeclaration"
        }
      }
    },
    "limitations": {
      "$ref": "#/$defs/nonEmptyStringList"
    },
    "differences": {
      "$ref": "#/$defs/nonEmptyStringList"
    },
    "requires": {
      "type": "object",
      "additionalProperties": false,
      "required": ["camunda"],
      "description": "Dependency envelope for a stable deployment of this skill. Each value is a semantic-version range (e.g. \">=8.8\", \">=3.0.0\", \"*\"). Informational per-skill metadata under the hybrid versioning model — the deployable, pinnable unit is the bundle version.",
      "properties": {
        "camunda": { "$ref": "#/$defs/versionRange" },
        "c8ctl": { "$ref": "#/$defs/versionRange" },
        "node": { "$ref": "#/$defs/versionRange" },
        "java": { "$ref": "#/$defs/versionRange" },
        "maven": { "$ref": "#/$defs/versionRange" },
        "docker": { "$ref": "#/$defs/versionRange" },
        "dmnlint": { "$ref": "#/$defs/versionRange" }
      }
    }
  },
  "$defs": {
    "harnessDeclaration": {
      "type": "object",
      "additionalProperties": false,
      "required": ["status", "differences"],
      "properties": {
        "status": {
          "type": "string",
          "enum": ["native", "adapter-required", "unsupported", "not-tested"]
        },
        "differences": {
          "$ref": "#/$defs/nonEmptyStringList"
        }
      }
    },
    "nonEmptyStringList": {
      "type": "array",
      "minItems": 1,
      "items": {
        "type": "string",
        "minLength": 1
      }
    },
    "versionRange": {
      "type": "string",
      "minLength": 1,
      "pattern": "^(\\*|(>=|>|<=|<|~|\\^|=)?(0|[1-9]\\d*)(\\.(0|[1-9]\\d*)){0,2})$"
    }
  }
}
