{
  "$schema": "https://raw.githubusercontent.com/camunda/skills/main/compatibility/portability.schema.json",
  "skillDirectory": "skills/camunda-connectors",
  "skillName": "camunda-connectors",
  "status": "portable-with-adapter",
  "agentSkillsSpec": {
    "specUrl": "https://agentskills.io/specification",
    "specRevisionOrAuditDate": "2026-09-11"
  },
  "harnesses": {
    "claude": {
      "status": "native",
      "differences": [
        "Loads the standard SKILL.md package and invokes the documented c8ctl element-template workflow."
      ]
    },
    "copilot": {
      "status": "adapter-required",
      "differences": [
        "Maps c8ctl element-template search, inspection, and apply commands to Copilot terminal capabilities."
      ]
    },
    "generic": {
      "status": "adapter-required",
      "differences": [
        "The host supplies c8ctl catalog access and BPMN file-editing adapters."
      ]
    }
  },
  "requires": {
    "camunda": ">=8.8",
    "c8ctl": ">=3.0.0"
  },
  "limitations": [
    "Basic connector template operations require c8ctl 3.0.0 or newer; use c8ctl 3.2.0 or newer for --engine-version discovery and --set FEEL auto-prefixing, plus access to the selected template catalog."
  ],
  "differences": [
    "Element-template IDs and property mappings are harness-neutral; catalog access and BPMN file editing are host-managed."
  ]
}
