{
  "$schema": "https://raw.githubusercontent.com/camunda/skills/main/compatibility/portability.schema.json",
  "skillDirectory": "skills/camunda-process-mgmt",
  "skillName": "camunda-process-mgmt",
  "status": "portable-with-adapter",
  "agentSkillsSpec": {
    "specUrl": "https://agentskills.io/specification",
    "specRevisionOrAuditDate": "2026-09-11"
  },
  "harnesses": {
    "claude": {
      "status": "native",
      "differences": [
        "Loads the standard SKILL.md package and invokes c8ctl with an explicit profile for mutations."
      ]
    },
    "copilot": {
      "status": "adapter-required",
      "differences": [
        "Maps c8ctl deployment, inspection, and mutation commands to Copilot terminal and credential capabilities."
      ]
    },
    "generic": {
      "status": "adapter-required",
      "differences": [
        "The host supplies profile selection, authentication, and result adapters for live cluster operations."
      ]
    }
  },
  "requires": {
    "camunda": ">=8.8",
    "c8ctl": ">=3.0.0"
  },
  "limitations": [
    "Live process operations require a reachable and authorized Camunda 8.8+ cluster plus an installed c8ctl CLI."
  ],
  "differences": [
    "Deployment and process-operation semantics are stable; profile credentials, endpoints, and confirmation prompts are host-managed."
  ]
}
